title,abstract,source,is_fsrdc
Measures,"Measures
1.	Anxiety Gad-7

The generalized anxiety disorder scale consists of 7 questions scoring between 0 and 3, therefore, the minimum and maximum possible scores are 0 and 21 respectively. To evaluate the results obtained when answering the questionnaire, the authors suggest the following scores, and consultation with a health professional is recommended when obtaining a score of 10 or higher:
Psychometric properties:
For the Spanish version, a cronbach's alpha coefficient of 0.93 was obtained. Taking into account the cut of 10 points, sensitivity values of 86.8% and specificity of 93.4% were found (Garcia et al, 2010). In the original version the internal consistency of the Gad-7 was excellent (cronbach = .92). Test-retest reliability was also good (intraclass correlation = 0.83). Comparison of the scores derived from the self-report scales with those derived from the versions administered by mhp from the same scales yielded similar results (intraclass correlation = 0.83), indicating good procedure validity (Spitzer et al. 2006).

2.	Behaviors and perceptions (psychological responses to Covid-19)

2.1.	 Behaviors
	Participants will be asked three questions about recent avoidance behaviors (avoiding eating out, avoiding public transportation, and reducing visits to public places) and three more about recommended behaviors (reprogramming the travel plan, increasing surface cleanliness, and maintain better indoor ventilation) in response to the outbreak. All questions were asked as ""during the past week, have you ever ... Due to the new coronavirus outbreak."" The possible answers for each question were yes or no.
Three sets of questions were asked to collect information on preventive behaviors on the typical days before March 6, 2020, when an unknown SARS-related outbreak of pneumonia was first reported, later identified as SARS cov-2 i, and then in the last week. The first two sets of questions regarding the frequency of wearing a face mask when leaving and the frequency of hand washing immediately upon returning home. The response options are scored never (such as 0), rare (1), sometimes (2), generally (3), always (4), or did not come out (5). The main reasons for using a face mask on the usual days and in the last week will be collected. The third set of questions on the duration of handwashing with five categories of answers from short to long (1 to 5), for less than 10 seconds, 10-19 seconds, 20-39 seconds, 40-59 seconds or 60 seconds and more, respectively.
Respondents whose responses for behaviors in the last week obtained higher scores than those of the usual days were categorized as greater frequency or duration of the aforementioned behaviors.
To capture the possible overreaction from the public, a follow-up question will be asked: ""In the past week, have you ever bought or tried to buy glasses for the purpose of protecting yourself against SARS-cov-2 infection?"" with two possible answers (yes or no).
Baijam (2015), refers that encouraging the public to adopt specific hygiene-related behaviors has proven to be useful to contain previous outbreaks of infectious diseases. Motivating the public to adopt such behaviors can be difficult. Studies of how people responded to the severe acute respiratory syndrome outbreak in 2002 suggest that perceptions or beliefs about an outbreak may be important in determining compliance with official advice. In particular, the literature on severe acute respiratory syndrome suggests that people may be more likely to comply with health-related recommendations if they believe that the recommended behaviors are effective, perceive a high probability that they may be affected by the outbreak, They perceive the disease as having serious consequences, they believe the disease is difficult to treat, and they believe that the government is providing clear and sufficient information about the outbreak and can be trusted to control the spread of the infection. Additionally, higher levels of anxiety or worry may be associated with increased behavioral changes.
Lau (2010), conducted a study to investigate community behavioral and emotional responses in the early phase after the identification of the first few cases of H1N1 in Hong Kong. Some other studies have investigated community attitude and behavior responses to the early phase of the H1N1 pandemic in countries such as the United States, Australia, Malaysia, and Europe, France, Japan. Avoidance behaviors have been frequent in several countries or cities, such as Hong Kong and Malaysia, but not in the United States. Mild emotional distress was noted in Hong Kong, but the public in Japan felt overwhelming fear. Most respondents to the Hong Kong study washed their hands more frequently than usual, but only about 30% of those in the United States did the same. Variations in perceived susceptibility and perceived efficacy over preventive measures have also been reported in these studies. Therefore, community responses to the H1N1 pandemic are likely to be country-specific, possibly determined by previous experiences with epidemics such as SARS, but which serve as the basis for formulating such studies on COVID-19, of use in the health system, risk communication patterns and even culture. The importance of this type of research is that it allows us to develop accessible protocols that are not disruptive to human behavior, that are based on the variability of human nature and that allow us to effectively manage the disappearance of infectious outbreaks

2.2.	Perception 

Five items will be used to assess whether participants believe that certain measures would reduce their risk of contracting covid-19, and the possible response options would be Ineffective (Not effective) (1), Considerable (Not effective) (2) and Effective (Effective) ) (3). The first three items (washing hands frequently, wearing a face mask, and avoiding going out) were consistent with the government-run ad campaign. The last two items (washing your mouth with salt water and taking vitamin C or a product of traditional medicine) were considered as misinformation by medical experts. Participants must respond that the first three items were effective and that the last two items were ineffective and classified as having the correct perceived efficacy of the behaviors.
Four items evaluated the perceived threats of the new coronavirus. Participants are asked ""How likely do you think you will get a new coronavirus infection in the next month""? With five responses from very unlikely (1) to very likely (5), and ""how serious do you think the new coronavirus infection would be if you contracted it"" with five options, from very mild (1) to very severe (5). Participants were also required to report relative transmissibility and severity compared to SARS in 2003, with five response categories of much lower (1), lower (2), similar (3), higher (4 ), much higher (5).
Three items assess how well informed the public is. Participants are asked ""if you received and read the informational brochure on the new coronavirus from the government and medical experts"" with two response options (yes or no). They are then asked to respond to the statement ""the information I received about the new coronavirus outbreak is sufficient"" with five options, from strongly disagree (1) to strongly agree (5). To assess the impact of mixed information during the outbreak, participants should answer the frequency with which they felt confused or concerned about the reliability of the information they received. Response options ranged from never (1) to always (5).
Public confidence is assessed by asking if they agreed with the statement ""I think I can take steps to protect myself against the new coronavirus"" with five response options from strongly disagree (1) to strongly agree (5).
Brug et al, 2004, after the SARS pandemic, reported that the perceived risk, not the actual risk, determines the reaction of the population, despite the fact that these perceptions are often biased. The public can be optimistic when family risks are perceived to be largely under volitional control; Pessimism, which sometimes leads to mass panic, is more likely as a result of perceiving that the risks are uncontrollable. People who perceive themselves to be at risk for SARS or in our covid-19 research may have preventive behavior, but may also stigmatize those who perceive themselves as potential sources of infection. To promote realistic risk perceptions and effective precautions, communication through various sources of information is essential, justifying our dimensions.
Along the same lines, Ping Wu (2010) reported that the literature has documented that the levels of risk perceived in relation to an event such as SARS or in this case Covid-19 are currently affected by lack of familiarity. and the perceived uncontrollability of the dangers involved and that this can have a direct impact on mental health and the development of disorders, given the high level and ignorance and uncontrollability, for example by the continuous exposure of health workers to traumatic events such as deaths and critical condition of patients as happened in Beijing in 2002, despite this, people differ in their perceptions of the same situation.
Understanding the role of specific perceptions in motivating people to engage in preventive behaviors can help health communicators improve their messages about outbreaks of new infectious diseases in general and specifically about Covid-19.
3.	SA-45 
It is a questionnaire that includes 45 items on a five-level Likert scale with items ranging from 0 (""not at all"") to 4 (""very or extremely""). The questionnaire is derived from the original symptom checklist 90 (Scl-90; Derogatis, Lipman &amp; Covi, 1973) and seeks to evaluate the following dimensions: somatization, obsessive compulsion, interpersonal sensitivity, depression, anxiety, hostility, phobic anxiety, ideation paranoid and psychoticism.
The questionnaire was developed mainly as a tool to evaluate the results obtained from different treatments applied to psychiatric patients (Davison et al., 1997), but studies with groups of non-clinical samples are being carried out as a means of determining the questionnaire and the potential usefulness of detecting the participants' general mental health level and / or the presence of any indication of psychological pathology or imbalance.
Created at the time to deal with the problems related to the scl.90: high overlap between items, low discriminant validity, imbalance of the scales in number of items (the scales have between 6 to 13 items), high correlation between scales, lack factorial validity and excessive length (Alvarado, Blanca; Sandín, Bonifacio; Valdez-Medina, Jose; Gonzales-Arratia Norma and Rivera, Sofia, 2012), the SA-45 maintains the same scales as the scl-90, but improvement in the following aspects:
• Significantly reduces the number of items (from 90 to 45 items)
• Equalizes all scales to the same number of items (5), which increases the possibility that the scales have similar reliability.
• Increases the ease and usefulness of the questionnaire.

Psychometric properties:
Despite still being much less in use than its predecessor, the SA-45 has shown its validity in various settings, such as clarification and prediction of psychiatric patients, evaluation of psychopathological changes in patients with health problems, studies on psychopathological screening (such as in epidemiological studies) and reflect effects of psychological treatment in psychiatric patients (Maruis, 2000, cited from Alvarado et al, 2012).
In 2008, a Spanish version of the SA-45 was validated by Sandin, Valiente, Chorot, and Santed, using an extensive sample of college students. Exploratory factor analyzes were carried out. Regarding the extraction of the number of factors, the researchers took into account 5 theoretical / empirical criteria: 9 basic dimensions, other possible structures found in the scl-90 (from 1 to 10 factors), Kaiser's criterion, screening test, interpretation of different resulting factor structures: the main axis method was also performed. In both cases, a structure of 9 correlated factors was obtained that corresponded to the nine subscales of the original Davison version. Oblique rotation results (promax) were presented, where moderate correlations were found between factors.
Using confirmatory factor analysis, the factor structure was replicated, where nine correlated factors were the structure that best fit the data, compared to single-factor structures (general factor of psychopathology), hierarchical model of nine primary factors, and two factors of higher order (neurosis and psychosis). It was concluded that SA-45 has scales that are separate, valid, and reliable, that are useful for various symptoms or psychopathological disorders. Compared with the scl-90, this test is abbreviated, and discriminates better, since the consistency of the dimensions and their validity has improved (Sandín et al., 2008). The cronbach's alpha of the total questionnaire is .95 (internal consistency) and, except for the psychoticism scale, all the subscales ranged from .71 to .85.
The SA-45 has been used in several aspects: merino in 2010 (cited from Alvarado et al, 2012), verified the utility of the instrument in individuals with burnout syndrome or work stress; Delclaux (2011, quoted from Alvarado et al, 2012) used it in patients diagnosed with cancer in chemotherapy regimen, where he found significant alterations in the subscales, mainly in depression, anxiety, somatization and obsession-compulsion; and it has also been used to assess the psychopathological effects of traumatic situations on ex-combatants of the Falklands war (Grill, Posada and Castañeiras, 2009).

4.	Intention to care patient with  Covid-19

A self-administered questionnaire (34 items) was used to collect data on intentions, attitude, subjective norm, perceived behavioral control, behavioral beliefs, normative beliefs, and control beliefs were the study variables. All items were measured using a 7-point likert scale (-3 to +3).
Kim et al, 2006, used the theory of planned behavior, which emerged through the theory of reasoned action (TRA) (Ajzen and Fishbein, 1980), at first Azjen and Fishbein (19880) argued that the mind, the motive or intention is a decisive factor that influences behaviors, so it was stated that the internal factor was the attitude towards a person's behavior (attitude), so this factor was accompanied by external factors, such as the opinions of others around them, that is, if their surroundings think they are important or invite them to do something they will eventually do so, however, research revealed that a person's intention does not necessarily lead to the practice of action, and they were plotted the limitations of TRA. Among the actions, there are actions that simply do not lead to the practice of the action by intention. For example, you want to exercise every day, but lack of time to exercise, the location of a distant gym, children who need attention, and housework. There are cases in which the act cannot be practiced although the intention is due to the surrounding conditions that interfere with the practice. So Azjen (1991) introduces the concept of perceived behavioral control, explained as the recognition of the ability to control behavior in the following way. Even if there are factors that interfere with the action, if you think you can adjust the obstacles to your own thoughts, you increase the intention to practice the action, and ultimately increase the degree of practice of the action. In conclusion, tpb affirms that human behavior is directly influenced by two factors: the intention of a person who wants to do it and the confidence that they can do it.
According to the theory of planned behavior (TBP), human behavior is guided by three types of considerations: beliefs about the likely consequences and experiences associated with the behavior (behavioral beliefs), beliefs about normative expectations, and behaviors of other significant people (beliefs regulations) and beliefs about the presence of factors that can facilitate or impede the performance of the behavior (control beliefs). In their respective aggregates, behavioral beliefs produce a favorable or unfavorable attitude toward behavior; normative beliefs result in perceived social pressure or subjective norm; and control beliefs lead to perceived behavioral control or self-efficacy. The effects of attitude toward behavior and subjective norm on intention are moderated by the perception of behavior control. As a general rule, the more favorable the attitude and subjective norm, and the greater the perceived control, the stronger the person's intention should be to perform the behavior in question. Finally, given a sufficient degree of actual control over behavior, people are expected to carry out their intentions when the opportunity arises. Therefore, intention is assumed to be the immediate antecedent to the behavior. To the extent that perceived behavioral control is true, it can serve as a proxy for actual control and contribute to predicting the behavior in question (Fishbein &amp; Azjen, 2010).

Psychometric properties:
Data were analyzed using descriptive statistics, pearson's correlation method and multiple step regression methods. Kim et al, 2006, points out that the validity and reliability of the instrument were established through content validity, a pilot test, a reliability test and factor analysis. The result of the study is described elsewhere (Yoo, Kwon and Jang, 2005).
In the research by Yoo et al, 2005, the psychometric analysis of the survey data provided empirical evidence of the construct validity and reliability of the instrument. The main component analysis verified the hypothetical solution of 6 factors, explaining 68.2% of the variance, and the alpha coefficients of .75 to .93 indicated a high internal consistency of the instrument.

5.	Risk Perception

Compared to other risk domains, such as environmental risks, much less is known about how the public perceives the risks associated with emerging infectious diseases (Zwart et al. 2009). Most of the evidence on risk perception comes from studies during previous pandemics, especially the H1N1 swine flu pandemic in 2009 (Fischhoff et al., 2018; Rudisill 2013; Prati, Pietrantoni and Zani 2011), the Ebola outbreak (Prati and Pietrantoni 2016; Yang and Chu 2018) and SARS and avian influenza (bird flu) epidemics (Leppin and Aro 2009). Although this research has been important and informative, reviews have noted that a common feature of rapid response studies is that many of them are exploratory and descriptive in nature and therefore a) are not based on established models of theory. risk perception, b) are based almost exclusively on single-element risk perception measures that selectively take advantage of cognitive or emotional dimensions, and c) do not include important international comparisons (de Zwart et al. 2009; Leppin and Aro 2009) .
Van der Linden's instrument, in collaboration with his team, contains 6 items to assess the perception that the new coronavirus COvid-19 represents in terms of risk, consequently, here we adopt a theory-based approach to the study of the perception of risk. Van der Linden's (2015, 2017) risk perception model recommends the inclusion of groups of variables that correspond to the cognitive tradition (for example, people's knowledge and understanding of risks) experiential tradition (for example, personal experience), the sociocultural paradigm (for example, the social amplification of risk, cultural theory, trust and values) and the relevant individual differences (for example, gender, education, ideology).

Psychometric Properties:
Following Leiserowitz (2006), Van der Linden (2015) and Xie et al. (2019), our dependent measure ""COVID-19 Risk Perception"" was measured as an index, covering affective, cognitive and spatio-temporal dimensions to provide a holistic measure of risk perception. The index included items that captured the perceived severity of the COVID-19 pandemic participants, the perceived probability of contracting the virus themselves for the next 6 months, the perceived probability that their family and friends would contract the virus, and its level current concern about the virus (alpha grouped in all countries, a .72; alpha per country, such as .60 - .82)
",step2,True
Impact of Vietnam-era G.I. Bill eligibility on later-life blood pressure distribution: evidence from the Vietnam draft lottery natural experiment,"Abstract
               We quantified the impact of Vietnam-era G.I Bill eligibility, which subsidized college education for eligible Veterans, on the later-life blood pressure distribution by exploiting the Vietnam draft lottery natural experiment. We restricted Health and Retirement Study data (2006-2018) to men born between 1947-1953 (N=1,970). We estimated intention-to-treat effects at the mean and 1st-99th quantiles of blood pressure using linear and quantile regressions. Our outcomes were systolic blood pressure (SBP), diastolic blood pressure (DBP), hypertension, and self-reported stroke. We proxied G.I. Bill eligibility using lottery-defined draft eligibility. We also conducted analyses stratified by childhood socioeconomic status (cSES) defined based on a previously validated measure. Draft eligibility reduced mean blood pressure outcomes (e.g., effect on SBP: -1.33 [95% confidence interval (CI) -2.85, 0.19]). Draft eligibility also had larger protective effects at higher quantiles of the SBP and DBP distributions relative to lower quantiles (effects on SBP at the 10th and 90th quantiles: -0.33mmHg [95% CI -2.35,1.68]; -3.00mmHg [95% CI -5.68,-0.32]). Draft eligibility had protective effects on blood pressure among low and medium cSES men but opposite effects among high cSES men. G.I. Bill eligibility reshaped the blood pressure distribution to one of lower morbidity risk, particularly among low and medium cSES men.",step2,True
"The Construction of the ""Older Worker""","The notion of the “older worker” is frequently used in the organizational literature, in organizational practice, and in society, but so far no research has investigated why people consider someone to be an older worker at a certain age. In the qualitative part of this study, we examined potential reasons for considering workers to be “older” at a certain age. In the quantitative part of this study, we investigated demographic characteristics (i.e., age, sex, education), job characteristics (i.e., job level, typical age in a job), and beliefs (i.e., perceived remaining time at work, motivation to continue working after retirement, positive and negative age stereotypes) as predictors of people’ conceptions of “older worker age.” Data were provided by 269 employees from various jobs and organizations. The mean age at which participants’ considered someone to be an “older worker” was approximately 55 years (SD = 8.9). The most frequently stated reasons for considering workers to be “older” at a certain age were retirement age and age-related decline. Results of a regression analysis showed that participants’ age, sex, and perceived remaining time predicted “older worker age.” These findings provide first insights into the psychological construction of the “older worker.”",step2,True
