title,abstract,source,is_fsrdc
Predicting Higher Education Enrollment Among Immigrant Descendants Using Random Forest,"Across many countries, students with an immigration background tend to complete less schooling than their non-immigrant peers (OECD, 2023a). Highly educated individuals tend to exhibit increased civic engagement, along with elevated employment rates and relative earnings (OECD, 2023a). Thus, immigrant students’ low enrollment rates in higher education may ultimately lead to a lower societal status. This is a concerning issue, given the increasing number of immigrant adolescents globally and the expected growth in immigration in the future (OECD, 2013). As a result, addressing the achievement gap among immigrant students is a top priority for politicians, social scientists, and the general public (Appel et al., 2015).
In South Korea (hereafter referred to as Korea), the university education system has undergone significant expansion to provide sufficient university seats for all high school graduates (Kim et al., 2018). And it is common for students to pursue tertiary education immediately after finishing their upper secondary education. The 2022 OECD survey has highlighted that Korea boasts the world's highest tertiary education attainment rate among young people (aged 25-34), with an impressive 69.29%. In comparison, the OECD global average is 47.4% (OECD, 2023b). The high percentage in Korea is attributed to the prevailing belief that increasing one's level of education typically results in better employment prospects and higher income levels (OECD, 2022). In 2020, the relative earnings of Korean workers, based on their educational achievements (with the wage of a high school graduate as the reference point set at 100), stood at 110.2% for college graduates, 138.3% for university graduates, and 182.3% for those holding graduate degrees (OECD, 2022).¹ However, immigrant descendants exhibit a significantly lower admission rate in higher education than native students. Table 1 (see File 1) compares the enrollment rates of students with an immigration background to those of the general population across different school levels. While there is not a significant difference in enrollment rates from elementary to high school, it is evident that there is a substantial gap in enrollment rates at the higher education level. The disparity in enrollment rates was 14.8% in 2015, 18% in 2018, and 31% in 2021, demonstrating a widening gap over time (Korean Ministry of Education &amp; Korean Educational Development Institute, 2021). Nevertheless, no research has yet uncovered the cause of this phenomenon.
It has been highlighted that the admission of immigrant descendants into higher education is constrained by language barriers, cultural disparities, lack of information on education policy and limited support due to economic disadvantages (Yang et al., 2020). However, it's important to note that no research has been conducted on these issues in Korea. South Korea's policy for assisting families with an immigration background has mainly focused on the initial settlement of immigrants. The present requirement calls for the practical support needed for children of families with an immigration background after they have settled. This study investigates the variables influencing higher education access among immigrant descendants and assesses their significance using Random Forest, a machine-learning approach. The research questions are as follows: 
(1)	What is the order of importance of the variables influencing access to higher education among immigrant descendants?
(2)	How does each variable influence access to higher education among immigrant descendants?
There have been studies on the determinants of access to higher education among non-immigrant students (Chan &amp; Hu, 2023; Kim, 2008b). However, these studies often lacked a comprehensive analysis and understanding as a selection of individual, family, and school-related variables were considered separately. Additionally, there has been an absence of research on access to higher education for immigrant descendants in Korea because there was no available data regarding this population. This is because the surge in the immigrant population in Korea predominantly occurred in the 1990s, resulting in their descendants representing a pioneering generation of students with an immigration background who are pursuing higher education in the 2020s. This study focuses on examining the variables that impact access to higher education, offering valuable insights into supporting immigrant descendants. If variables related to predetermined conditions beyond individual control or actions affect access to higher education, the possibility of social mobility through their own efforts diminishes (Kim, 2008b). Therefore, exploring the variables that influence students' decisions to pursue higher education from the perspective of educational inequality is of great importance. 
Studies investigating the variables that impact higher education admissions or choices, as well as the motivations of high school students to pursue higher education, have been consistently carried out in various countries. Nevertheless, these variables have seldom been systematically ranked or organized according to their respective degrees of importance. 
Perna's (2006) conceptual model (see Figure 1 in File 1) offered a comprehensive perspective of students' college decision-making. The framework integrated two key paradigms in this topic: human capital investment (Becker, 1962, 1993; Long, 2004) and sociological-cultural approaches (Hearn, 1984, 1988; McDonough, 1997). It assumed that four contextual nested layers influence an individual's college choice decisions: (1) the individual's habitus, (2) the school and community context (organizational habitus), (3) the higher education context, and (4) the social, economic, and policy context. Due to data collection limitations, our study only concentrated on the first (individual habitus) and second (organizational habitus) layers of the model that are more directly related to college choice. We have drawn various associated variables with these two layers from previous studies and reclassified the variables into individual, family, and school-related variables based on their sources.
By investigating these variables comprehensively, the findings of the study provide important information regarding immigrant students' access to higher education. This information is useful for reducing the likelihood of growing educational disparities between immigrant descendants and native students, as well as addressing concerns related to the potential widening of future social class gaps.",step2,True
Repeated Exposure to Fake Business News: Reverse Order,"In this experiment, we would like to test the effectiveness of different fake news warnings (false vs disputed) after a prior fake news exposure without any warning. We aim to understand how consumers judge brands when they are first exposed to fake news denigrating those brands and then exposed to the same piece of fake news for the second time, but with a fact-checking warning. We will mainly test the effectiveness of two different fake news warning types in immunizing consumers against the detrimental impact of fake news: ""False based on 3rd Party Fact-Checkers"" and ""Disputed by 3rd Party Fact-Checkers"" warnings.",step2,True
A study on public attitudes towards China's high-skilled immigration policy reform,"Currently, the global competition for technological talent is intensifying。The shortage of international talent not only affects the research and development process in high-tech fields but also hinders industrial transformation and the optimization of economic structures. Moreover, public attitudes toward high-tech immigration are crucial as these directly impact the implementation and effectiveness of policies. With the development of economic globalization, an increasing number of foreigners are choosing to study, work, or even settle in China, which has sparked social dissatisfaction, with topics such as special treatment for international students and the African immigrant community in Guangzhou frequently triggering online criticism. In February 2020, China's Ministry of Justice released the ""Draft Regulations on the Permanent Residence of Foreigners in the People's Republic of China,"" which ignited negative public sentiment. Chinese scholars believe that there are still gaps in the policy system, admission standards, social security and living services, and the actual development and introduction of high-level talent (Liu Yungang &amp; Chen Yue, 2015).

The introduction of high-tech immigrants is dependent not only on policy formulation and execution but also significantly on social acceptance. Public attitudes towards high-tech immigrants can significantly affect the effective implementation of policies and the success of foreign talent recruitment. First, public attitudes directly influence the attraction and retention of foreign high-tech talents. A positive social acceptance environment can make foreign talents feel welcomed, increasing their satisfaction with working and living in China, thereby encouraging more high-tech talents to choose to develop their careers in China. Conversely, if the public holds xenophobic or hostile attitudes, potential high-tech talents may have reservations about living and working in China, reducing their willingness to come. Second, public attitudes decisively affect the level of support for policies. Broad public support for high-tech immigration policies can facilitate the smooth implementation of these policies, providing the government with greater operational space and social legitimacy. For example, if the public widely believes that the introduction of foreign high-tech talents significantly contributes to national technological development, the government will receive more societal support when formulating more open immigration policies. On the other hand, if the public opposes, it may increase resistance during policy implementation, possibly leading to policy adjustments or changes. Moreover, public attitudes also play a crucial role in shaping China's international image and relations. How China handles and reflects public attitudes toward high-tech immigration directly influences the international community's perception of China's openness and inclusiveness.",step2,True
Outside options in households of Mbendjele BaYaka,"Distribution of tasks for the successful running of households (complementary coordination) are subject to many factors. In this study, we investigate the role of outside options in determining the repartition of tasks between men and women.  

(data analysis and modeling plans were updated; and new specifications can be found on: https://osf.io/b7nse)

Distributing household tasks in a complementary fashion increases efficiency, providing a fitting example of complementary coordination e.g. if one cooks and cleans, the other does the house repairs. The output of complementary coordination - a successfully running household - is beneficial to both parties. However, the inputs must be divided in an asymmetric manner.

We predict that this distribution, within the possible degree of flexibility, will be dependent on what outside options the respective parties have. More specifically, the individual having better outside options (measured by relational wealth) will enjoy advantage in the division of coordination strategies (measured by their daily leisure time). This analysis can be made within the couple (between sex) and between couples (within sex). In the former, gendered sex roles and traditions will need to be controlled for. In the latter, the household size and composition will need to be controlled for.

We analyze ethnographic data of hunter-gatherer camps from the Central African Republic and Northern Republic of Congo to test our hypotheses. The population is known as Mbendjele BaYaka. They are semi-nomadic people, following an immediate-return economic system, because of which they do not have any accumulated resources or means of financial income. Their main form of wealth in these societies is their social wealth - measured in terms of relations and popularity within camp (Woodburn, 1982). This will be the measure of our independent variable, outside options. They engage in demand sharing, wherein everyone has the right to demand access to material objects and equal sharing, bringing about egalitarianism in the group. Both males and females have active political voice and decision-making power in marriage. There is emphasis on personal autonomy, making it a good fit for our hypothesis - an individual’s outside options weigh on their bargaining power. The influence of conventional gendered norms in household coordination pose a major confound to our hypothesis, which gets removed in this population of egalitarian hunter-gatherers.",step2,True
"Reallocation, Firm Dynamics, and Productivity Growth: Evidence from Eswatini’s Manufacturing Sector","Abstract
        See mansucript PDF file for abstract with equation
This article investigates the contributions of real productivity, firm-size rationalization, and net-entry effects to aggregate labour productivity (ALP) growth using a panel dataset from Eswatini’s manufacturing sector. It compares these results with what obtains in world economies at different stages of development. After controlling for extreme values, it found a persistent annual average increase of 2.67% in real productivity. The sector also experienced labour reallocation gains of 0.26% from incumbents and suffered losses of 0.43% from the entry/exit margins. Thus, within-firm effects dominated the intensive and extensive forms of labour input reallocation a fortiori. Further, cross-sectional distributions of up-to the fourth-order moment of labour shortages were used as sources of exogenous variation in endogenous aggregate employment growth when estimating the impact of the latter on reallocation. The first-order moment was strongly associated with changes in aggregate employment growth while higher-order moments had insignificant effects. In contrast, the reshuffling of labour among incumbents and across sectors was robustly unresponsive to variations in aggregate employment growth. However, a unit percentage point increase in aggregate employment growth from a Two Stage Least Squares (TSLS) estimator inversely varied with net-entry effects at the rate of β̂ 𝑇𝑆𝐿𝑆𝜖(-0.976, -0.926), depending on model specification.
JEL Classification: J24, L6, O47.",step2,True
A cross-institutional analysis of the effects of broadening trainee professional development on research productivity,"PhD-trained scientists are essential contributors to the workforce in diverse employment sectors that include academia, industry, government, and non-profit organizations. Hence, best practices for training the future biomedical workforce are of national concern. Complementing coursework and laboratory research training, many institutions now offer professional training that enables career exploration and develops a broad set of skills critical to various career paths. The National Institutes of Health funded academic institutions to design innovative programming to enable this professional development through a mechanism known as Broadening Experiences in Scientific Training (BEST). Programming at the BEST awardee institutions included career panels, skill-building workshops, job-searching workshops, site visits, and internships. Because doctoral training is lengthy and requires focused attention on dissertation research, an initial concern was that students participating in additional complementary training activities might exhibit an increased time to degree or diminished research productivity. Metrics were analyzed from ten BEST awardee institutions to address this concern, using time to degree and publication records as measures of efficiency and productivity. Comparing doctoral students who participated to those who did not, results revealed that across these diverse academic institutions, there were no differences in time to degree or manuscript output. Furthermore, a few institutions demonstrated a positive correlation between participation in career and professional development activities and productivity. Our findings support the policy that doctoral students should participate in career and professional development opportunities that are intended to prepare them for a variety of diverse and important careers in the workforce.

Note: Institutional data has been de-identified and each file corresponds to institutional labels consistent with publication manuscript (e.g., ""Institution A"" in manuscript corresponds to file ""ZA TTD data deidentified""; Brandt et al, 2021). Columns for each institutional data set include: coded trainee ID; trainee participation data and dose-bin assigned; time to degree and/or defense; and number of publications (total, first author, and/or pub metric composite score).",step2,True
"Characteristics, causes, and consequences of technical debt in the automation domain","Technical Debt (TD) is a significant concern in software development, particularly when interdisciplinary teams collaborate and interact. The goal of the study to investigate TD causal chains patterns industrial automation sector by analyzing 123 mechatronic incidents from 47 expert interviews across ten companies. Findings reveal that Requirements, Process, Test are most common, while Build, Versioning, Manufacturing, Code, Maintenance/Service less frequent. Key causes include ""other priorities"", ""lack time"", ""historically grown products"", market analysis"" ""copy-paste-modify without revising tolerances."" research identifies correlations between subtypes causes/consequences relation company size, experts' experience, position, utilizing Chi-square test PrefixSpan algorithm. also maps contagious character using Neo4J graphical representation. This first in-depth analysis contributes qualitatively understanding patterns, helping researchers practitioners assess contagiousness, comprehend its effects, prevent diffusion, develop repayment strategies To best our knowledge, this study's quantitative approach provides foundation will enable future identifying metrics management multidisciplinary engineering.",step2,True
"Characteristics, Causes, and Consequences of Technical Debt in the Automation Domain","Technical decisions that yield short-term benefits but prove to be disruptive and costly in the long-term are often made because their scope, impact, remedial actions underappreciated or underestimated. Debt (TD), a metaphor for such phenomena, is especially harmful when interdisciplinary teams collaborate interact with one another. Based on 47 semi-structured expert interviews ten companies operating automation sector, this paper presents TD modeling scheme used investigate causal chains 123 mechatronic incidents include 368 items. This study identifies most frequent types, subtypes, causes/consequences while analyzing them correlation company size, experts' experience position. Furthermore, we elaborate existing patterns by applying quantitative methods of Chi-square test PrefixSpan. Consequently, visualize contagious character life cycle mapping initiating subsequently affected parties using graphical representation Neo4J. first in-depth within industrial domain. To best our knowledge, study's approach provides foundation enables future research identifying metrics management multidisciplinary engineering.",step2,True
Supply and Demand Shocks on Construction Projects caused by COVID-19,"

Supply and Demand Shocks on Construction Projects caused by COVID-19 WHO officially announced outbreak of COVID-19 disease on March 11th 20201.

COVID-19 has caused local, regional &amp; worldwide economic and medical problems. COVID-19 disruption and delay implications &amp; affects on construction projects (but not limited to): negatively affected engineering and construction projects in different ways. labor and skilled worker shortages due to travel bans and temporarily or permanent self-isolations reduces the ability for a return to the engineering and construction projects. interrupted supply chain and interrupted procurement processes for construction materials, plants and equipment's relevant for the progress of construction project. disruptions and delays to deliver the project in time to a certain extent. contractor may bar and tight up still to a concrete and fixed delivery time for the project and liability for delays associated with a contractual liquidated damage provision or penalized milestone. no experience with such pandemic for entire construction world but adversely affect global and local supply chains and demand. ultimately, the contractor’s ability to perform and progress will be restricted or even collapse. If the progress of the contractor falls behind schedule or is suspended he is not able to invoice with negative affect to the contractors cashflow.
",step2,True
Firm Dynamics and Trade," We review the literature that studies the dynamics of firms in foreign markets, at both the intensive and extensive margins, and their aggregate implications. We first summarize a set of micro facts on exporter entry, expansion, contraction, and exit and several macro facts about the response of aggregate trade flows to trade-policy and business-cycle shocks. We then present the canonical model developed to account for these facts and discuss its connection to the empirical evidence. We show how three model features—future uncertain profits, an investment in market access, and high depreciation of that access upon exit—generate transition dynamics and long-run aggregate outcomes from a cut in tariffs. The model and its extensions contribute to our understanding of trade integration and the evolution of future trade barriers. We discuss the key challenges faced by the canonical model, its possible extensions, and applications of the framework to recent global events. ",step2,True
Precursors of the Commutative Principle in Preschoolers,"In a previous study, we showed that 2nd grade children do not spontaneously perceive that 3 groups of 2 dots and 2 groups of 3 dots contain the same number of dots, even if they know that 3x2 and 2x3 are equal. They, however, exhibit a better understanding of the commutativity of addition. A possible explanation for these findings is that, as opposed to addition, the symmetry in commutative multiplication directly appears only in the symbolic format, while linguistic and visuo-spatial  non-symbolic representations, such as seeing or saying “2 groups of 3 dots”, involve two levels of  embedding that make them harder to interpret. In other words, the commutative principle in additive contexts is intrinsically one-dimensional (1D), while it is arguably intrinsically two-dimensional (2D) in multiplication. The proposed study aims at investigating the existence of precursors of the understanding of the commutative principle in preschoolers, and the type of representations (geometric, linguistic, etc.) that  preferentially support them. 
To do so, 5-year-old children are presented with various situations in which they are asked to judge whether two characters got a fair or an unfair share of apples. Each trial thus presents a pair of sets of apples, that probes children’s understanding of commutative multiplication (with simple grouping such as 3 groups of 2 apples versus 2 groups of 3 apples, or using rectangular displays in both horizontal and vertical orientations), and control it against commutative addition and mere identity, as well as all their unequal counterparts. To assess the influence of language, each situation is presented first without any linguistic cues, and then accompanied by a full linguistic description.",step2,True
Explaining prosecution outcomes for cryptocurrency-based financial crimes,"Cryptocurrencies have been used to commit various offences, but enforcement efforts remain underdeveloped relative to the value of these crimes. This paper examines factors associated with outcomes of U.S.-based cryptocurrency financial crime prosecutions. We studied the 37 resolved cryptocurrency-based financial crime cases in the U.S. to date, exploring the impact of offence, defendant, and evidence characteristics on the mode of disposition and penalties. We used bivariate analyses and logistic regression models to determine relationships among these variables.  The presence of individual defendants only (rather than a corporate defendant or combination thereof) and the use of only a cryptocurrency other than Bitcoin in committing a crime each made a case less likely to be resolved by dismissal, trial, or summary or default judgment. This paper is the first to examine variables contributing to financial crime prosecution outcomes and has implications for prosecutorial decision-making, resource allocation, and the prevention and detection of financial offences involving cryptocurrencies.",step2,True
