,ProjectID,ProjectStatus,ProjectTitle,ProjectRDC,ProjectStartYear,ProjectEndYear,ProjectPI,OutputTitle,OutputBiblio,OutputType,OutputStatus,OutputVenue,OutputYear,OutputMonth,OutputVolume,OutputNumber,OutputPages,DOI,Authors,Abstract,DoiExtract,NormTitle,MatchType,Uniqueness,FuzzScores,FSRDC_related
186,16269485,,Looking back on three years of Synthetic LBD Beta,,,,"Miranda, Javier",Looking back on three years of Synthetic LBD Beta,,,,,,,,,,,"Miranda, Javier, Vilhuber, Lars","Distributions of business data are typically much more skewed than those for household or individual data and public knowledge of the underlying units is greater. As a results, national statistical offices (NSOs) rarely release establishment or firm-level business microdata due to the risk to respondent confidentiality. One potential approach for overcoming these risks is to release synthetic data where the establishment data are simulated from statistical models designed to mimic the distributions of the real underlying microdata. The US Census Bureau\u27s Center for Economic Studies in collaboration with Duke University, the National Institute of Statistical Sciences, and Cornell University made available a synthetic public use file for the Longitudinal Business Database (LBD) comprising more than 20 million records for all business establishment with paid employees dating back to 1976. The resulting product, dubbed the SynLBD, was released in 2010 and is the first-ever comprehensive business microdata set publicly released in the United States including data on establishments employment and payroll, birth and death years, and industrial classification. This paper documents the scope of projects that have requested and used the SynLBD",,lookingbackonthreeyearsofsyntheticlbdbeta,,True,47.0,True
189,619649390,,INVESTIGATIONS OF SORTING AND NON-WAGE MARKET CLEARING: THREE ESSAYS IN LABOR ECONOMICS,,,,"Smith, Andrew",INVESTIGATIONS OF SORTING AND NON-WAGE MARKET CLEARING: THREE ESSAYS IN LABOR ECONOMICS,,,,,,,,,,,"Smith, Andrew","This dissertation is comprised of three essays in labor economics. The first investigates a natural experiment in the internal labor market policies of the US Air Force. The second bounds the causal effects of attaining a college double major. The third studies the causes and consequences of queueing for government sector jobs in Brazil. The US Department of the Air Force, like many large organizations with rigid and central- ized internal labor markets, has recently introduced an algorithmically-assisted person-job matching system to replace their older, manual procedure. This change has been touted as a way to improve both organizational efficiency and to increase the satisfaction of its workforce. In this chapter, I leverage parallel trends and plausibly unexpected variation in the timing of the roll-out of this program in order to calculate its effect on one of the few margins of adjustment available in the military context: retention of personnel. I find that the system had meaningfully large effects on those who actively interacted with it: officers’ average quit rate fell by 37%. While still being introduced for enlisted members, the aver- age quit rate for the initial treatment group in the enlisted force has fallen by 76%. These improvements, comparable in effect to a $25,000 retention bonus, are especially notable for having essentially zero marginal cost to implement. Double majoring has become an increasingly salient phenomenon in recent years, as the returns to higher education have grown. Currently, over 15 percent of college graduates in the U.S. graduate with more than one major. While much research exists on the re- turns to different individual majors, less is known about the causal effects of double ma- joring. This chapter provides novel estimates on the returns to double majoring. We im- prove upon prior studies that rely on controls for observable characteristics by address- ing selection concerns in two notable ways. First, by including institution fixed effects, we control for institution-specific differences that may influence both the decision to double major and subsequent earnings. Second, we adopt a partial identification approach to ad- dress non-random selection into double majoring within institutions, providing informa- tive bounds on the returns to double majoring. Results broadly align with estimates from prior studies at the aggregate level but reveal notable gender differences. Women experi- ence an earnings return to double majoring of between 2 to 5 percent, while the return for men is statistically negligible. Our analysis suggests that this discrepancy is primarily at- tributable to signaling effects in the labor market, which may help to offset the gender pay gap. Finally, we show that public sector jobs in Brazil are characterized by price and quantity controls in the form of wages larger than those of private sector counterparts but with a limited number of employment contracts (analogous to a quota). Entrance to public sector jobs is decided according to the results of a double-blinded admission exam. The result- ing combination prevents the usual price mechanism from equating the value of supplying labor to private or public sector jobs. We show that the equilibrium mechanism operates through increases in the candidate-to-vacancy ratios that reduce the likelihood of success at any attempt to access a public sector job. In our empirical analysis, we look at exams administered between 2007 and 2017. We show that the value of time spent waiting actu- ally exceeds the average gain, dissipating all rents that would otherwise be generated by the public wage premium",,investigationsofsortingandnonwagemarketclearing:threeessaysinlaboreconomics,,True,53.0,True
192,232567126,,FIRM CHARACTERISTICS AND ORGANIZATIONAL CHANGE:  THE EFFECTS OF ELECTRONIC COMMERCE IN THE UNITED STATES MANUFACTURING INDUSTRY,,,,"Wallace, Candice Y.",FIRM CHARACTERISTICS AND ORGANIZATIONAL CHANGE:  THE EFFECTS OF ELECTRONIC COMMERCE IN THE UNITED STATES MANUFACTURING INDUSTRY,,,,,,,,,,,"Wallace, Candice Y.","This dissertation seeks to provide insight to how e-commerce adoption and utilization change the condition of U.S. Manufacturing establishments, by answering two interrelated questions: (1) What are the characteristics of manufacturing establishments that were early adopters of e-commerce activities?; (2) Once e-commerce is adopted, how has adoption affected employment within manufacturing establishments? The U.S. manufacturing industry was selected for analysis as manufacturing has been and continues to be an important sector for employment and the overall U.S. economy and has been the primary sector responsible for the majority of Business-to-Business e-commerce activity.
Using two econometric models, seemingly unrelated regression (SUR) and three stage-least squares (3SLS), this dissertation confirms previous research pertaining to the characteristics of firms that were early adopters of e-commerce. However, this dissertation also provides insights for how manufacturing firms change after the implementation of e-commerce. Specifically, findings suggest that e-commerce adoption has a negative effect on manufacturing jobs between 1999 and 2005. Simultaneously, the loss in jobs does not translate into an increase in wages for those still employed. The findings of this dissertation also do not provide a positive outlook for a “spatially equitable landscape” to develop via the dissemination of e-commerce in the U.S. manufacturing industry. Rather, the results suggest that the application of e-commerce will continue to reinforce the geographical advantages of firms in urban areas verses those located in more rural areas",,firmcharacteristicsandorganizationalchange:theeffectsofelectroniccommerceintheunitedstatesmanufacturingindustry,,True,55.0,True
193,6280399,,Cross–Sectoral Variation in Firm–Level Idiosyncratic Risk,,,,Rui Castro,Cross–Sectoral Variation in Firm–Level Idiosyncratic Risk,,,,,,,,,,,"Rui Castro, Gian Luca Clementi, Yoonsoo Lee","We estimate firm–level idiosyncratic risk in the U.S. manufacturing sector. Our proxy for risk is the volatility of the portion of growth in sales or TFP which is not explained by either industry– or economy–wide factors, or firm characteristics systematically associated with growth itself. We find that idiosyncratic risk accounts for about 90% of the overall uncertainty faced by firms. The extent of cross–sectoral variation in idiosyncratic risk is remarkable. Firms in the most volatile sector are subject to at least three times as much uncertainty as firms in the least volatile. Our evidence indicates that idiosyncratic risk is higher in industries where the extent of creative destruction is likely to be greater.Schumpeterian Competition, Creative Destruction, Product Turnover, R&D Intensity, Investment–Specific Technological Change",,cross–sectoralvariationinfirm–levelidiosyncraticrisk,,True,55.0,True
194,552640227,,"Pay, productivity and management",,,,"Bloom, Nicholas","Pay, productivity and management",,,,,,,,,,,"Bloom, Nicholas, Ohlmacher, Scott W., Tello-Trillo, Cristina J., Wallskog, Melanie","Using confidential Census matched employer-employee earnings data we find that employees at more productive firms, and firms with more structured management practices, have substantially higher pay, both on average and across every percentile of the pay distribution. This pay-performance relationship is particularly strong amongst higher paid employees, with a doubling of firm productivity associated with 11% more pay for the highest-paid employee (likely the CEO) compared to 4.7% for the median worker. This pay-performance link holds in public and private firms, although it is almost twice as strong in public firms for the highest-paid employees. Top pay volatility is also strongly related to productivity and structured management, suggesting this performance-pay relationship arises from more aggressive monitoring and incentive practices for top earners",,payproductivityandmanagement,,True,67.0,True
198,33615801,,Synthetic Establishment Microdata Around the World,,,,"Vilhuber, Lars",Synthetic Establishment Microdata Around the World,,,,,,,,,,,"Vilhuber, Lars, Abowd, John, Reiter, Jerome P","In contrast to the many public-use microdata samples available for individual and household data from many statistical agencies around the world, there are virtually no establishment or firm microdata available. In large part, this difficulty in providing access to business micro data is due to the skewed and sparse distributions that characterize business data. Synthetic data are simulated data generated from statistical models. We organized sessions at the 2015 World Statistical Congress and the 2015 Joint Statistical Meetings, highlighting work on synthetic \emph{establishment} microdata. This overview situates those papers, published in this issue, within the broader literature",,syntheticestablishmentmicrodataaroundtheworld,,True,56.0,True
200,83602631,,2008 Research Report: Center for Economic Studies and Research Data Centers,,,,,2008 Research Report: Center for Economic Studies and Research Data Centers,,,,,,,,,,,,"The contributions of individuals from within and outside the Census
Bureau were essential to producing this report. B.K. Atrostic wrote
Chapter 1; Matthew Graham wrote Chapter 2; John Haltiwanger,
Ron Jarmin, and Javier Miranda coauthored Chapter 3; Richard
Burkhauser and Jeff rey Larrimore of Cornell University coauthored
Chapter 4; Randy Becker and Cheryl Grim coauthored Chapter 5;
and Todd Gardner wrote Chapter 6. Thanks also are due to Lynn
Riggs who organized Appendix 1; and Angela Andrus, Cheryl
Grim, Brian Holly, Sang Nguyen, Shigui Weng, and Jeremy Wu
who contributed to or worked on Appendixes 1 through 7.
 Janet Sweeney and Jamie Stark of the Administrative and Customer
Services Division, Francis Grailand Hall, Chief, provided publications
and printing management, graphics design and composition, and
editorial review for print and electronic media. General direction and
production management were provided by Claudette E. Bennett,
Assistant Division Chief, and Wanda Cevis, Chief, Publications
Services Branch.
 Finally, our RDC partners and administrators provided assistance.The Center for Economic Studies partners with stakeholders within
and outside the U.S. Census Bureau to improve measures of the economy
and people of the United States through research and innovative
data products.This report has not undergone the review accorded Census Bureau
publications and no endorsement should be inferred. Any opinions
and conclusions expressed herein are those of the author(s) and do
not necessarily represent the views of the Census Bureau or other
organizations. All results have been reviewed to ensure that no confi -
dential information is disclosed",,2008researchreport:centerforeconomicstudiesandresearchdatacenters,,True,51.0,True
202,4754486,,"Sustainable metropolitan development: a look at planning and development in Atlanta, Georgia",,,,"Chandler, Sharon","Sustainable metropolitan development: a look at planning and development in Atlanta, Georgia",,,,,,,,,,,"Chandler, Sharon","This study analyzes the relationship between comprehensive planning and actual development (as measured by changes in welfare) for 158 jurisdictions in metropolitan Atlanta. Relying on ecological economics for a method to measure welfare and planning literature for a method to evaluate the content of comprehensive plans, this dissertation uses a combination of quantitative and qualitative methods.
 
Development is measured for four dimensions of sustainable development (economic, social, environment, and resource) using a modified Genuine Progress Indicator, and the metropolitan Atlanta area is found to have had weakly sustainable development from 1980 to 2000. In all places, economic welfare increased and resource welfare decreased. Social and environmental development had mixed results with about half of jurisdictions showing increases in environmental welfare while less than a handful showed increases in social welfare. 

Comprehensive plans were found to have a range of overall plan quality scores (the average of scores of policy statements in a plan) from 1.3 to 3.2 with a mean of 2.3 out of a maximum of 4. Of 2564 policy statements, 541 (or 21\%) were high quality statements scoring 4/4 points while 708 (or 28\%) received no quality points - they were weakly worded, vague, and not measurable. The average commitment to sustainable development (percent of policy statements in a plan that are related to a principle of sustainable development) is 39\% with a minumum of 9\% and a maximum of 80\%. Plan policy statements coded for principles of sustainable development were found to have significantly higher quality scores while overall plan quality scores were not found to be correlated to the plan commmitment to sustainable development; this implies that plans are generally either rigid (having highs scores) or visionary (having high commitment to sustainable development) overall.

Plan quality was found to have a significant negative relationship with sustainable development, when dimensions are considered. This relationship was stronger for plans completed within the study time period (before 2000), suggesting that this relationship may be causal. The negative result is unexpected and leads to a rejection of the hypothesis that high quality planning would be significantly and positively related to development.

On the other hand, plan commitment to sustainable development was found to be weakly positively related to sustainable development although the dimensions of this relationship changed over time. As such, the hypothesis that commitment to sustainable development would be significantly and positively related to development cannot be rejected.

These results hold even when looking at distinct growth patterns across the metropolitan region, suggesting that the relationships between plans and development may be applicable to other places.Ph.D",,sustainablemetropolitandevelopment:alookatplanninganddevelopmentinatlantageorgia,,True,51.0,True
204,195375548,,Has the NSF-Census Bureau Research Network Helped Improve the U.S. Statistical System?,,,,"Vilhuber, Lars",Has the NSF-Census Bureau Research Network Helped Improve the U.S. Statistical System?,,,,,,,,,,,"Vilhuber, Lars, Weinberg, Daniel H.","This presentation summarizes parts of http://hdl.handle.net/1813/52650.2, ""Effects of a Government-Academic Partnership: Has the NSF-Census Bureau Research Network Helped Improve the U.S. Statistical System?"", by Weinberg, Daniel; Abowd, John M.; Belli, Robert F.; Cressie, Noel; Folch, David C.; Holan, Scott H.; Levenstein, Margaret C.; Olson, Kristen M.; Reiter, Jerome P.; Shapiro, Matthew D.; Smyth, Jolene; Soh, Leen-Kiat; Spencer, Bruce; Spielman, Seth E.; Vilhuber, Lars; Wikle, ChristopherPresentation made by Lars Vilhuber, PI of the NSF-Census Research Network (NCRN) Coordinating Office on behalf of the network at the Joint Statistical Meetings (JSM) 2018 in a session presenting the award winners from 2017. https://ww2.amstat.org/meetings/jsm/2018/onlineprogram/ActivityDetails.cfm?SessionID=215028NSF-1129475 to Northwestern University; NSF-1130706 to Carnegie Mellon University; NSF-1131500 to University of Michigan-Ann Arbor; NSF-1131848 to Cornell University; NSF-1131897 to Duke University and National Institute of Statistical Sciences (NISS); NSF-1132008 to University of Colorado-Boulder; NSF-1132015 to University of Nebraska-Lincoln; NSF-1132031 to University of Missouri; and NSF-1507241 for the Coordinating Office (Cornell, Duke, and NISS)",,hasthensfcensusbureauresearchnetworkhelpedimprovetheusstatisticalsystem?,,True,46.0,True
205,558912475,,Does Access to Family Planning Increase Children’s Opportunities?,,,,"Bailey, Martha J",Does Access to Family Planning Increase Children’s Opportunities?,,,,,,,,,,10.3368/jhr.54.4.1216-8401r1,"Bailey, Martha J, Malkova, Olga, McLaren, Zoë M","This paper examines the relationship between parents' access to family planning and the economic resources of their children. Using the county-level introduction of U.S. family planning programs between 1964 and 1973, we find that children born after programs began had 2.8% higher household incomes. They were also 7% less likely to live in poverty and 12% less likely to live in households receiving public assistance. A bounding exercise suggests that the direct effects of family planning programs on parents' resources account for roughly two-thirds of these gains",103368jhr5441216-8401r1,doesaccesstofamilyplanningincreasechildren’sopportunities?,,True,62.0,True
207,617197497,,The Centrality of Data and Compute for AI Innovation: A Blueprint for the National Research Cloud,,,,"Ho, Daniel E.",The Centrality of Data and Compute for AI Innovation: A Blueprint for the National Research Cloud,,,,,,,,,,,"Ho, Daniel E., King, Jennifer, Wald, Russell C., Wan, Christopher","From the introduction: Artificial intelligence (AI) appears poised to transform the economy across sectors ranging from healthcare and finance to retail and education. What some have coined the “Fourth Industrial Revolution” is driven by three key trends: greater availability of data, increases in computing power, and improvements to algorithm design. First, increasingly large amounts of data have fueled the ability for computers to learn, such as by training an algorithmic language model on all of Wikipedia. Second, better computational capacity (often termed “compute”) and compute capability have enabled researchers to build models that were unimaginable merely ten years ago, spanning billions of parameters (an exponential increase in scope from previous models). Third, basic innovations in algorithms are helping scientists to drive forward AI, such as the reinforcement learning techniques that enabled a computer to defeat the world champion in the board game Go",,thecentralityofdataandcomputeforaiinnovation:ablueprintforthenationalresearchcloud,,True,54.0,True
210,93344874,,Research Funding and Regional Economies,,,,"Goldschlag, Nathan",Research Funding and Regional Economies,,,,,,,,,,10.2139/ssrn.2817445,"Goldschlag, Nathan, Bianchini, Stefano, Lane, Julia, SanMartin Sola, Joseba, Weinberg, Bruce A.","Public support of research typically relies on the notion that universities are engines of economic development, and that university research is a primary driver of high wage localized economic activity. Yet the evidence supporting that notion is based on aggregate descriptive data, rather than detailed links at the level of individual transactions. Here we use new micro-data from three countries - France, Spain and the United States - to examine one mechanism whereby such economic activity is generated, namely purchases from regional businesses. We show that grant funds are more likely to be expended at businesses physically closer to universities than at those farther away. In addition, if a vendor has been a supplier to a grant once, that vendor is subsequently more likely to be a vendor on the same or related grants. Firms behave in a way that is consistent with the notion that propinquity is good for business; if a firm supplies a research grant at a university in a given year it is more likely to open an establishment near that university in subsequent years than other firms",102139ssrn2817445,researchfundingandregionaleconomies,,True,57.0,True
212,492396814,,Estimating Determinants of Transportation and Warehousing Establishment Locations Using U.S. Administrative Data,,,,Craig Carpenter,Estimating Determinants of Transportation and Warehousing Establishment Locations Using U.S. Administrative Data,,,,,,,,,,,"Craig Carpenter, Rebekka Dudensing, Anders Van Sandt","Interactions between transportation and warehousing and other industry clusters are not widely explored and the determinants of logistics locational determinants is limited in the U.S. context. These gaps in the literature, along with the U.S. transportation and warehousing sector's decentralization from urban areas and concentration in regions, highlight the importance of understanding the effects of place-based factors and inter-industry clusters on the locations and employment of transportation and warehousing industries. The analysis uses restricted-access U.S. Census Bureau data aggregated to the county level, along with secondary data sources, to estimate the locational determinants of transportation and warehousing (TW) industries based on transportation infrastructure as well as sociodemographic and institutional variables. The analysis takes a cross-sectional (non-causal) approach to focus on time-invariant location factors while testing and implementing zero-inflated count data distributions to model the data generation processes more accurately. Results indicate that subsectors are affected differently by infrastructure, sociodemographic, and institutional variables. Additionally, different factors are associated with industry presence versus size. Finally, we show that data using aggregated industries obscures locational factors' importance for individual sub-sectors and, further, that industrial aggregation obscures TW sectors' relationships to other clusters",,estimatingdeterminantsoftransportationandwarehousingestablishmentlocationsusingusadministrativedata,,True,78.0,True
213,621742991,,"Part 3: If You Zone It, They Will Come: Housing Supply in Hampton Roads",,,,"Dragas Center for Economic Analysis and Policy, Old Dominion University","Part 3: If You Zone It, They Will Come: Housing Supply in Hampton Roads",,,,,,,,,,10.25776/ryty-bc04,"Dragas Center for Economic Analysis and Policy, Old Dominion University","The recent rise in housing prices in Hampton Roads has priced many families out of the American dream of owning a home. Even though fewer houses sold in 2023, median single-family prices continued to rise. In this chapter, we discuss how policies and regulations may influence decisions to build and ask what can be done to increase the supply of housing in Hampton Roads",1025776ryty-bc04,part3:ifyouzoneittheywillcome:housingsupplyinhamptonroads,,True,48.0,True
214,639366211,,2024 State of the Commonwealth Report,,,,"Agarwal, Vinod",2024 State of the Commonwealth Report,,,,,,,,,,10.25776/aprq-ba29,"Agarwal, Vinod, Koch, James V., Lian, Feng, Makhorkina, Anna, Nguyen, Melody, Parker, Terry, Rahoui, Mohamed, Walker, Jay, Yuenyong, Leiu","This is Old Dominion University’s 10th annual State of the Commonwealth Report. While it represents the work of many people connected in various ways to the university, the report does not constitute an official viewpoint of Old Dominion, its president, Brian Hemphill, Ph.D., the Board of Visitors, the Strome College of Business or the generous donors who support the activities of the Dragas Center for Economic Analysis and Policy.
Our work seeks to contribute to the conversation about how Virginia can foster growth across the Commonwealth without glossing over the challenges we face. We want to encourage difficult conversations to improve economic outcomes for all of Virginia’s residents. There is plenty of good news to share, and now is the time to have the hard discussions about where Virginia goes over the next decade",1025776aprq-ba29,2024stateofthecommonwealthreport,,True,45.0,True
