,ProjectID,ProjectStatus,ProjectTitle,ProjectRDC,ProjectStartYear,ProjectEndYear,ProjectPI,OutputTitle,OutputBiblio,OutputType,OutputStatus,OutputVenue,OutputYear,OutputMonth,OutputVolume,OutputNumber,OutputPages,DOI,Authors,Abstract,DoiExtract,NormTitle,MatchType,Uniqueness,FuzzScores,FSRDC_related
94,W2034190452,,"Advances in Record-Linkage Methodology as Applied to Matching the 1985 Census of Tampa, Florida",,,,Matthew A. Jaro,"Advances in Record-Linkage Methodology as Applied to Matching the 1985 Census of Tampa, Florida","{'volume': '84', 'issue': '406', 'first_page': '414', 'last_page': '420'}",article,,,1989.0,,84.0,406,414-420,https://doi.org/10.1080/01621459.1989.10478785,Matthew A. Jaro,"Abstract A test census of Tampa, Florida and an independent postenumeration survey (PES) were conducted by the U.S. Census Bureau in 1985. The PES was a stratified block sample with heavy emphasis placed on hard-to-count population groups. Matching the individuals in the census to the individuals in the PES is an important aspect of census coverage evaluation and consequently a very important process for any census adjustment operations that might be planned. For such an adjustment to be feasible, record-linkage software had to be developed that could perform matches with a high degree of accuracy and that was based on an underlying mathematical theory. A principal purpose of the PES was to provide an opportunity to evaluate the newly implemented record-linkage system and associated methodology. This article discusses the theoretical and practical issues encountered in conducting the matching operation and presents the results of that operation. A review of the theoretical background of the record-linkage problem provides a framework for discussions of the decision procedure, file blocking, and the independence assumption. The estimation of the parameters required by the decision procedure is an important aspect of the methodology, and the techniques presented provide a practical system that is easily implemented. The matching algorithm (discussed in detail) uses the linear sum assignment model to ""pair"" the records. The Tampa, Florida, matching methodology is described in the final sections of the article. Included in the discussion are the results of the matching itself, an independent clerical review of the matches and nonmatches, conclusions, problem areas, and future work required. Key Words: Census adjustmentCensus coverage evaluationEM algorithmPostenumeration survey",10108001621459198910478785,advancesinrecordlinkagemethodologyasappliedtomatchingthe1985censusoftampaflorida,,True,50.0,True
96,W2118502261,,Multiple Imputation for Nonresponse in Surveys,,,,Donald B. Rubin,Multiple Imputation for Nonresponse in Surveys,"{'volume': None, 'issue': None, 'first_page': None, 'last_page': None}",book,,,1987.0,,,,,https://doi.org/10.1002/9780470316696,Donald B. Rubin,"Tables and Figures. Glossary. 1. Introduction. 1.1 Overview. 1.2 Examples of Surveys with Nonresponse. 1.3 Properly Handling Nonresponse. 1.4 Single Imputation. 1.5 Multiple Imputation. 1.6 Numerical Example Using Multiple Imputation. 1.7 Guidance for the Reader. 2. Statistical Background. 2.1 Introduction. 2.2 Variables in the Finite Population. 2.3 Probability Distributions and Related Calculations. 2.4 Probability Specifications for Indicator Variables. 2.5 Probability Specifications for (X,Y). 2.6 Bayesian Inference for a Population Quality. 2.7 Interval Estimation. 2.8 Bayesian Procedures for Constructing Interval Estimates, Including Significance Levels and Point Estimates. 2.9 Evaluating the Performance of Procedures. 2.10 Similarity of Bayesian and Randomization--Based Inferences in Many Practical Cases. 3. Underlying Bayesian Theory. 3.1 Introduction and Summary of Repeated--Imputation Inferences. 3.2 Key Results for Analysis When the Multiple Imputations are Repeated Draws from the Posterior Distribution of the Missing Values. 3.3 Inference for Scalar Estimands from a Modest Number of Repeated Completed--Data Means and Variances. 3.4 Significance Levels for Multicomponent Estimands from a Modest Number of Repeated Completed--Data Means and Variance--Covariance Matrices. 3.5 Significance Levels from Repeated Completed--Data Significance Levels. 3.6 Relating the Completed--Data and Completed--Data Posterior Distributions When the Sampling Mechanism is Ignorable. 4. Randomization--Based Evaluations. 4.1 Introduction. 4.2 General Conditions for the Randomization--Validity of Infinite--m Repeated--Imputation Inferences. 4.3Examples of Proper and Improper Imputation Methods in a Simple Case with Ignorable Nonresponse. 4.4 Further Discussion of Proper Imputation Methods. 4.5 The Asymptotic Distibution of (Qm,Um,Bm) for Proper Imputation Methods. 4.6 Evaluations of Finite--m Inferences with Scalar Estimands. 4.7 Evaluation of Significance Levels from the Moment--Based Statistics Dm and Dm with Multicomponent Estimands. 4.8 Evaluation of Significance Levels Based on Repeated Significance Levels. 5. Procedures with Ignorable Nonresponse. 5.1 Introduction. 5.2 Creating Imputed Values under an Explicit Model. 5.3 Some Explicit Imputation Models with Univariate YI and Covariates. 5.4 Monotone Patterns of Missingness in Multivariate YI. 5.5 Missing Social Security Benefits in the Current Population Survey. 5.6 Beyond Monotone Missingness. 6. Procedures with Nonignorable Nonresponse. 6.1 Introduction. 6.2 Nonignorable Nonresponse with Univariate YI and No XI. 6.3 Formal Tasks with Nonignorable Nonresponse. 6.4 Illustrating Mixture Modeling Using Educational Testing Service Data. 6.5 Illustrating Selection Modeling Using CPS Data. 6.6 Extensions to Surveys with Follow--Ups. 6.7 Follow--Up Response in a Survey of Drinking Behavior Among Men of Retirement Age. References. Author Index. Subject Index. Appendix I. Report Written for the Social Security Administration in 1977. Appendix II. Report Written for the Census Bureau in 1983.",1010029780470316696,multipleimputationfornonresponseinsurveys,,True,57.0,True
97,W2916774960,,"Summary health statistics for U.S. adults: national health interview survey, 2012.",,,,Debra L. Blackwell,"Summary health statistics for U.S. adults: national health interview survey, 2012.","{'volume': None, 'issue': '260', 'first_page': '1', 'last_page': '161'}",article,,,2014.0,,,260,1-161,,"Debra L. Blackwell, Jacqueline W Lucas, Tainya C. Clarke","This report presents detailed tables from the 2012 National Health Interview Survey (NHIS) for the civilian noninstitutionalized adult population, classified by sex, age, race and Hispanic origin, education, current employment status, family income, poverty status, health insurance coverage, marital status, and place and region of residence. Estimates (frequencies and percentages) are presented for selected chronic conditions and mental health characteristics, functional limitations, health status, health behaviors, health care access and utilization, and human immunodeficiency virus testing. Percentages and percent distributions are presented in both age-adjusted and unadjusted versions.NHIS is a household, multistage probability sample survey conducted annually by interviewers of the U.S. Census Bureau for the Centers for Disease Control and Prevention's National Center for Health Statistics. In 2012, data were collected on 34,525 adults in the Sample Adult questionnaire. The conditional response rate was 79.7%, and the final response rate was 61.2%. The health information for adults in this report was obtained from one randomly selected adult per family.In 2012, 61% of adults aged 18 and over had excellent or very good health. Eleven percent of adults had been told by a doctor or other health professional that they had heart disease, 24% had been told on two or more visits that they had hypertension, 9% had been told that they had diabetes, and 21% had been told that they had some for of arthritis, rheumatoid arthritis, gout, lupus, or fibromyalgia. Eighteen percent of adults were current smokers and 21% were former smokers. Based on estimates of body mass index, 35% of adults were overweight and 28% were obese.",,summaryhealthstatisticsforusadults:nationalhealthinterviewsurvey2012,,True,47.0,True
98,W1564173202,,"Current Population Reports, P60-235, Income, Poverty, and Health Insurance Coverage in the United States: 2007",,,,Carmen DeNavas-Walt,"Current Population Reports, P60-235, Income, Poverty, and Health Insurance Coverage in the United States: 2007","{'volume': None, 'issue': None, 'first_page': None, 'last_page': None}",article,,,2008.0,,,,,https://doi.org/10.13016/ulfd-hsp8,"Carmen DeNavas-Walt, Bernadette D. Proctor, Jessica Smith","This report presents data on income, poverty, and health insurance coverage in the United States based on information collected in the 2008 and earlier Annual Social and Economic Supplements (ASEC) to the Current Population Survey (CPS) conducted by the U.S. Census Bureau. Data presented in this report indicate the following: • Real median household income increased between 2006 and 2007—the third annual increase.1 • The poverty rate was not statistically different between 2006 and 2007. • Both the number and the percentage of people without health insurance coverage decreased between 2006 and 2007. These results were not uniform across groups. For example, between 2006 and 2007, real median household income rose for non-Hispanic Whites and Blacks but remained statistically unchanged for Asians and Hispanics; the poverty rate increased for children under 18 years old but remained statistically unchanged for people 18 to 64 years old and people 65 and over; and the percentage of people without health insurance decreased for the native-born population, while the foreign-born population remained statistically unchanged.2, 3 These results are discussed in more detail in the three main sections of this report income, poverty, and health insurance coverage. Each section presents estimates by characteristics such as race, Hispanic origin, nativity, and region. Other topics include earnings of year-round, full-time workers; families in poverty; and health insurance coverage of children. This report concludes with a section discussing health insurance coverage by state using 2- and 3-year averages.",1013016ulfd-hsp8,currentpopulationreportsp60235incomepovertyandhealthinsurancecoverageintheunitedstates:2007,,True,53.0,True
99,W2161685332,,"Income, Poverty, and Health Insurance Coverage In The United States: 2006",,,,Carmen DeNavas-Walt,"Income, Poverty, and Health Insurance Coverage In The United States: 2006","{'volume': None, 'issue': None, 'first_page': None, 'last_page': None}",dataset,,,2007.0,,,,,https://doi.org/10.1037/e668082007-001,"Carmen DeNavas-Walt, Bernadette D. Proctor, Jessica Smith",U.S. Department of Commerce Economics and Statistics Administration U.S. CENSUS BUREAU 14.3 7.6 1.1 11.9 1.4 13.2 1.6 17.1 1.9 * 0.6 12.6 0.7 * 1.1 9.2 1.2 0.9 1.0 7.5 1.1 1.0 7.6 1.3 * 1.1 16.7 1.9 * 1.5 11.9 0.9 0.7 1.5 1.2 1.4 1.2 1.6 * 1.2 0.9 0.7 0.9 0.9 1.1 1.2 14.3 11.8 1.2 9.2 0.7 9.0 10.0 1.0 10.1 1.2 12.7 1.2 11.4 1.3 13.1 9.0 1.0 9.2 1.1 9.6 13.2 1.3 12.7 1.4 13.8 15.2 0.8 15.4 0.9 15.2 8.0 1.0 6.7 1.0 9.1 9.8 1.1 9.8 1.2 9.9 8.0 1.0 8.1 1.1 8.1 10.4 1.1 10.2 1.2 10.8 15.6 1.3 15.2 1.4 15.6 8.6 0.9 8.9 1.1 8.6,101037e668082007-001,incomepovertyandhealthinsurancecoverageintheunitedstates:2006,,True,58.0,True
100,W2326890393,,Job creation and destruction,,,,,Job creation and destruction,"{'volume': '34', 'issue': '03', 'first_page': '34', 'last_page': '1653'}",article,,,1996.0,,34.0,03,34-1653,https://doi.org/10.5860/choice.34-1653,,"Job Creation and Destruction is the culmination of a long, ongoing research program at the Center for Economic Studies. Using the most complete plant- level data source currently available--the Longitudinal Research Data constructed by the Census Bureau--it focuses on the U.S. manufacturing sector from 1972 to 1988 and develops a statistical portrait of the microeconomic adjustments to the many economic events that affect businesses and workers. The picture that emerges is one of large, persistent, and highly concentrated gross job flows, with job destruction dominating the cyclical feaures of net job flows.The authors describe in detail those characteristics that destroy and create jobs over time (including industry of origin, wage payments, international trade exposure, factor intensity, size, age, and productivity performance), while also providing a broader measure of the process that will be directly relevant to macroeconomists and policymakers.",105860choice34-1653,jobcreationanddestruction,,True,67.0,True
101,W2056279562,,phyloseq: An R Package for Reproducible Interactive Analysis and Graphics of Microbiome Census Data,,,,Paul J. McMurdie,phyloseq: An R Package for Reproducible Interactive Analysis and Graphics of Microbiome Census Data,"{'volume': '8', 'issue': '4', 'first_page': 'e61217', 'last_page': 'e61217'}",article,,,2013.0,,8.0,4,e61217-e61217,https://doi.org/10.1371/journal.pone.0061217,"Paul J. McMurdie, Susan Holmes","Background The analysis of microbial communities through DNA sequencing brings many challenges: the integration of different types of data with methods from ecology, genetics, phylogenetics, multivariate statistics, visualization and testing. With the increased breadth of experimental designs now being pursued, project-specific statistical analyses are often needed, and these analyses are often difficult (or impossible) for peer researchers to independently reproduce. The vast majority of the requisite tools for performing these analyses reproducibly are already implemented in R and its extensions (packages), but with limited support for high throughput microbiome census data. Results Here we describe a software project, phyloseq, dedicated to the object-oriented representation and analysis of microbiome census data in R. It supports importing data from a variety of common formats, as well as many analysis techniques. These include calibration, filtering, subsetting, agglomeration, multi-table comparisons, diversity analysis, parallelized Fast UniFrac, ordination methods, and production of publication-quality graphics; all in a manner that is easy to document, share, and modify. We show how to apply functions from other R packages to phyloseq-represented data, illustrating the availability of a large number of open source analysis techniques. We discuss the use of phyloseq with tools for reproducible research, a practice common in other fields but still rare in the analysis of highly parallel microbiome census data. We have made available all of the materials necessary to completely reproduce the analysis and figures included in this article, an example of best practices for reproducible research. Conclusions The phyloseq project for R is a new open-source software package, freely available on the web from both GitHub and Bioconductor.",101371journalpone0061217,phyloseq:anrpackageforreproducibleinteractiveanalysisandgraphicsofmicrobiomecensusdata,,True,45.0,True
102,W2133915381,,Estimates of the prevalence of arthritis and other rheumatic conditions in the United States: Part II,,,,Reva C. Lawrence,Estimates of the prevalence of arthritis and other rheumatic conditions in the United States: Part II,"{'volume': '58', 'issue': '1', 'first_page': '26', 'last_page': '35'}",article,,,2007.0,,58.0,1,26-35,https://doi.org/10.1002/art.23176,"Reva C. Lawrence, David T. Felson, Charles G. Helmick, Lesley M. Arnold, Hyon K. Choi, Richard A. Deyo, Sherine E. Gabriel, Rosemarie Hirsch, Marc C. Hochberg, Gene G. Hunder, Joanne M. Jordan, Jeffrey N. Katz, Hilal Maradit Kremers, Frederick Wolfe","Abstract Objective To provide a single source for the best available estimates of the US prevalence of and number of individuals affected by osteoarthritis, polymyalgia rheumatica and giant cell arteritis, gout, fibromyalgia, and carpal tunnel syndrome, as well as the symptoms of neck and back pain. A companion article (part I) addresses additional conditions. Methods The National Arthritis Data Workgroup reviewed published analyses from available national surveys, such as the National Health and Nutrition Examination Survey and the National Health Interview Survey. Because data based on national population samples are unavailable for most specific rheumatic conditions, we derived estimates from published studies of smaller, defined populations. For specific conditions, the best available prevalence estimates were applied to the corresponding 2005 US population estimates from the Census Bureau, to estimate the number affected with each condition. Results We estimated that among US adults, nearly 27 million have clinical osteoarthritis (up from the estimate of 21 million for 1995), 711,000 have polymyalgia rheumatica, 228,000 have giant cell arteritis, up to 3.0 million have had self‐reported gout in the past year (up from the estimate of 2.1 million for 1995), 5.0 million have fibromyalgia, 4–10 million have carpal tunnel syndrome, 59 million have had low back pain in the past 3 months, and 30.1 million have had neck pain in the past 3 months. Conclusion Estimates for many specific rheumatic conditions rely on a few, small studies of uncertain generalizability to the US population. This report provides the best available prevalence estimates for the US, but for most specific conditions more studies generalizable to the US or addressing understudied populations are needed.",101002art23176,estimatesoftheprevalenceofarthritisandotherrheumaticconditionsintheunitedstates:partii,,True,55.0,True
103,W3126010795,,Gender differences in business performance: evidence from the Characteristics of Business Owners survey,,,,Robert W. Fairlie,Gender differences in business performance: evidence from the Characteristics of Business Owners survey,"{'volume': '33', 'issue': '4', 'first_page': '375', 'last_page': '395'}",article,,,2009.0,,33.0,4,375-395,https://doi.org/10.1007/s11187-009-9207-5,"Robert W. Fairlie, Alicia Robb","Using confidential microdata from the U.S. Census Bureau, we investigate the performance of female-owned businesses, making comparisons to male-owned businesses. Using regression estimates and a decomposition technique, we explore the role that human capital, especially through prior work experience, and financial capital play in contributing to why female-owned businesses have lower survival rates, profits, employment, and sales. We find that female-owned businesses are less successful than male-owned businesses because they have less startup capital, less business human capital acquired through prior work experience in a similar business, and less prior work experience in a family business. We also find some evidence that female business owners work fewer hours and may have different preferences for the goals of their businesses, which may have implications for business outcomes.",101007s11187-009-9207-5,genderdifferencesinbusinessperformance:evidencefromthecharacteristicsofbusinessownerssurvey,,True,74.0,True
104,W1555600854,,Derivation of Research Diagnostic Criteria for Insomnia: Report of an American Academy of Sleep Medicine Work Group,,,,Jack D. Edinger,Derivation of Research Diagnostic Criteria for Insomnia: Report of an American Academy of Sleep Medicine Work Group,"{'volume': '27', 'issue': '8', 'first_page': '1567', 'last_page': '1596'}",review,,,2004.0,,27.0,8,1567-1596,https://doi.org/10.1093/sleep/27.8.1567,"Jack D. Edinger, Michael H. Bonnet, Richard R. Bootzin, Karl Doghramji, Cynthia M. Dorsey, Colin A. Espie, Andrew O. Jamieson, W. Vaughn McCall, Charles M. Morin, Edward J. Stepanski","Insomnia is a highly prevalent, often debilitating, and economically burdensome form of sleep disturbance caused by various situational, medical, emotional, environmental and behavioral factors. Although several consensually-derived nosologies have described numerous insomnia phenotypes, research concerning these phenotypes has been greatly hampered by a lack of widely accepted operational research diagnostic criteria (RDC) for their definition. The lack of RDC has, in turn, led to inconsistent research findings for most phenotypes largely due to the variable definitions used for their ascertainment. Given this problem, the American Academy of Sleep Medicine (AASM) commissioned a Work Group (WG) to review the literature and identify those insomnia phenotypes that appear most valid and tenable. In addition, this WG was asked to derive standardized RDC for these phenotypes and recommend assessment procedures for their ascertainment. This report outlines the WG's findings, the insomnia RDC derived, and research assessment procedures the WG recommends for identifying study participants who meet these RDC.",101093sleep2781567,derivationofresearchdiagnosticcriteriaforinsomnia:reportofanamericanacademyofsleepmedicineworkgroup,,True,46.0,True
105,W2128600649,,Probabilistic linkage of large public health data files,,,,Matthew A. Jaro,Probabilistic linkage of large public health data files,"{'volume': '14', 'issue': '5-7', 'first_page': '491', 'last_page': '498'}",article,,,1995.0,,14.0,5-7,491-498,https://doi.org/10.1002/sim.4780140510,Matthew A. Jaro,"Abstract Probabilistic linkage technology makes it feasible and efficient to link large public health databases in a statistically justifiable manner. The problem addressed by the methodology is that of matching two files of individual data under conditions of uncertainty. Each field is subject to error which is measured by the probability that the field agrees given a record pair matches (called the m probability) and probabilities of chance agreement of its value states (called the u probability). Fellegi and Sunter pioneered record linkage theory. Advances in methodology include use of an EM algorithm for parameter estimation, optimization of matches by means of a linear sum assignment program, and more recently, a probability model that addresses both m and u probabilities for all value states of a field. This provides a means for obtaining greater precision from non‐uniformly distributed fields, without the theoretical complications arising from frequency‐based matching alone. The model includes an interative parameter estimation procedure that is more robust than pre‐match estimation techniques. The methodology was originally developed and tested by the author at the U.S. Census Bureau for census undercount estimation. The more recent advances and a new generalized software system were tested and validated by linking highway crashes to Emergency Medical Service (EMS) reports and to hospital admission records for the National Highway Traffic Safety Administration (NHTSA).",101002sim4780140510,probabilisticlinkageoflargepublichealthdatafiles,,True,48.0,True
106,W2162107892,,Overview of Race and Hispanic Origin: Census 2000 Brief.,,,,Elizabeth M. Grieco,Overview of Race and Hispanic Origin: Census 2000 Brief.,"{'volume': None, 'issue': None, 'first_page': None, 'last_page': None}",article,,,2001.0,,,,,,"Elizabeth M. Grieco, Rachel Cassidy","Every census must adapt to the decade in which it is administered. New technologies emerge and change the way the U.S. Census Bureau collects and processes data. More importantly, changing lifestyles and emerging sensitivities among the people of the United States necessitate modifications to the questions that are asked. One of the most important changes for Census 2000 was the revision of the questions on race and Hispanic origin to better reflect the country’s growing diversity.",,overviewofraceandhispanicorigin:census2000brief,,True,45.0,True
107,W1901031838,,Screening for depression during pregnancy with the edinburgh depression scale (EDDS),,,,Declan Murray,Screening for depression during pregnancy with the edinburgh depression scale (EDDS),"{'volume': '8', 'issue': '2', 'first_page': '99', 'last_page': '107'}",article,,,1990.0,,8.0,2,99-107,https://doi.org/10.1080/02646839008403615,"Declan Murray, John Cox",Abstract One hundred women attending a maternity hospital antenatal clinic who were between 28 and 34 weeks gestation completed the EPDS and were then interviewed using a standardized psychiatric interview. EPDS scores were compared with RDC diagnosis of major and minor depression and with total weighted score derived from the interview. The EPDS identified all women with RDC major depression but was less effective in detecting those with RDC minor depression.,10108002646839008403615,screeningfordepressionduringpregnancywiththeedinburghdepressionscale(edds),,True,46.0,True
